[
  {
    "id": "1941-pearl-harbor:event-striking-force-sails",
    "title": "The striking force leaves Hitokappu Bay",
    "at": "1941-11-25T21:00:00Z",
    "kind": "movement",
    "significance": "major",
    "place": "place:hitokappu-bay",
    "summary": "**26 November, Japan time.** Six carriers, two battleships, cruisers, destroyers, three submarines and a train of oilers leave an empty anchorage in the southern Kurils, in radio silence, at twelve to fourteen knots, for a point some three thousand nautical miles away that the order calls point Z. The instant here is 0600 on 26 November in Tokyo, which is still 25 November in Washington — so the force was at sea before the American proposal that Tokyo would call an ultimatum had even been handed over.",
    "links": {
      "formations": ["1941-pearl-harbor:kido-butai", "1941-pearl-harbor:supply-force"],
      "people": ["person:nagumo-chuichi"],
      "places": ["place:hitokappu-bay"]
    },
    "sources": [
      {
        "source": "source:japanese-monograph-97",
        "pages": "7, 21",
        "note": "the departure “with utmost secrecy from Hitokappu Bay on 26 November”, “at a speed of 12-14 knots”. The hour is 0600, Tokyo time"
      }
    ]
  },
  {
    "id": "1941-pearl-harbor:event-hull-note",
    "title": "The American outline is handed to Nomura",
    "at": "1941-11-26T21:00:00Z",
    "kind": "diplomatic",
    "significance": "major",
    "place": "place:washington-dc",
    "summary": "**26 November, Washington.** The Secretary of State hands the Japanese ambassador an “Outline of Proposed Basis for Agreement Between the United States and Japan”: four principles, ten steps, and at number three the withdrawal of all Japanese military, naval, air and police forces from China and from Indochina. It was a statement of terms rather than a demand with a deadline, and it was read in Tokyo as the end of the negotiation. The document itself carries the date and no hour; the instant shown here is the afternoon and is nominal.",
    "links": {
      "people": ["person:hull-cordell", "person:nomura-kichisaburo"],
      "places": ["place:washington-dc"],
      "documents": ["1941-pearl-harbor:document-american-outline"]
    },
    "sources": [
      {
        "source": "source:peace-and-war-1943",
        "note": "doc. 257, file 711.94/2504 — the full text, dated Washington, November 26, 1941"
      }
    ]
  },
  {
    "id": "1941-pearl-harbor:event-roosevelt-to-the-emperor",
    "title": "Roosevelt appeals to the Emperor",
    "at": "1941-12-06T17:00:00Z",
    "kind": "diplomatic",
    "significance": "minor",
    "place": "place:washington-dc",
    "summary": "**6 December, Washington.** The President writes directly to the Emperor of Japan. By then the striking force had been eleven days at sea and was a day and a half from its launching point. Only the date is documented here; the hour shown is nominal.",
    "links": {
      "people": ["person:roosevelt-franklin"],
      "places": ["place:washington-dc", "place:tokyo"]
    },
    "sources": [
      {
        "source": "source:peace-and-war-1943",
        "note": "doc. 264, President Roosevelt to Emperor Hirohito of Japan, December 6, 1941"
      }
    ]
  },
  {
    "id": "1941-pearl-harbor:event-opana-radar",
    "title": "Opana plots a large flight at a hundred and thirty miles",
    "at": "1941-12-07T17:32:00Z",
    "kind": "other",
    "significance": "minor",
    "place": "place:opana-point",
    "summary": "**0702, Honolulu.** The Army's northernmost radar set on Oahu plots a group of aircraft at about 130 miles, bearing almost due north — which is the direction the striking force was in. The plot was telephoned to the information centre about a quarter of an hour later. The officer on duty there, present “solely for training and observation”, knew that a flight of B-17s was due in from the mainland and that naval aircraft were searching, and did not think any action was called for.",
    "links": {
      "places": ["place:opana-point"],
      "formations": ["1941-pearl-harbor:hawaiian-department", "1941-pearl-harbor:strike-first-wave"]
    },
    "sources": [
      {
        "source": "source:craven-cate-aaf-1",
        "note": "ch. 6 — “At 0702 the station plotted a group of airplanes at approximately 130 miles, bearing 0° to 3° east of north. This fact was reported by telephone to the information center about fifteen minutes later.” The officer's reasons are quoted from the same passage. No page is written; see the pack README"
      }
    ]
  },
  {
    "id": "1941-pearl-harbor:event-first-wave-attacks",
    "title": "The first wave over Oahu",
    "at": "1941-12-07T18:25:00Z",
    "kind": "battle",
    "significance": "major",
    "place": "place:pearl-harbor",
    "summary": "**0755, Honolulu — 1325 in Washington.** Single-engine aircraft are seen south-east of the Hickam Field hangar line heading for Pearl Harbor, and the naval base and the airfield come under attack almost at the same moment. The battle line is in the harbour; the three American carriers are at sea.",
    "links": {
      "places": ["place:pearl-harbor", "place:battleship-row", "place:hickam-field"],
      "formations": [
        "1941-pearl-harbor:strike-first-wave",
        "1941-pearl-harbor:pacific-fleet",
        "1941-pearl-harbor:hawaiian-department"
      ],
      "people": ["person:fuchida-mitsuo"],
      "battles": ["1941-pearl-harbor:oahu"]
    },
    "sources": [
      {
        "source": "source:craven-cate-aaf-1",
        "note": "ch. 6 — “At 0755 single-engine planes were observed southeast of the Hickam Field hangar line heading for Pearl Harbor. Almost simultaneously the naval base and Hickam Field came under attack.”"
      },
      {
        "source": "source:morton-1962",
        "note": "ch. VI — the first wave “reached Oahu, ‘still asleep in the morning mist,’ at 0750”, and the first bombs fell five minutes later. The two accounts differ by five minutes and the pack takes the later one"
      }
    ]
  },
  {
    "id": "1941-pearl-harbor:event-second-wave-attacks",
    "title": "The second wave",
    "at": "1941-12-07T19:10:00Z",
    "kind": "battle",
    "significance": "major",
    "place": "place:pearl-harbor",
    "summary": "**0840, Honolulu.** Level and dive bombers renew the attack, against a defence that is now awake and firing.",
    "links": {
      "places": ["place:pearl-harbor"],
      "formations": ["1941-pearl-harbor:strike-second-wave"],
      "battles": ["1941-pearl-harbor:oahu"]
    },
    "sources": [
      {
        "source": "source:craven-cate-aaf-1",
        "note": "ch. 6 — “At 0840 horizontal and dive bombers renewed the attack.”"
      }
    ]
  },
  {
    "id": "1941-pearl-harbor:event-memorandum-delivered",
    "title": "The Japanese memorandum is handed over, an hour after the first bomb",
    "at": "1941-12-07T19:20:00Z",
    "kind": "diplomatic",
    "significance": "major",
    "place": "place:washington-dc",
    "summary": "**1420, Washington — 0850 in Honolulu.** The Japanese ambassador had asked for an appointment at one o'clock, put it back to a quarter to two, arrived at five past two and was received at twenty past. He said he had been instructed to deliver the document at one and that decoding had delayed him; asked why one o'clock, he said he did not know, that was his instruction. One o'clock in Washington was half past seven in Honolulu, twenty-five minutes before the first bomb. He handed it over at twenty past two, eighty minutes after the hour he had been given and fifty-five minutes after the first bomb fell.",
    "links": {
      "people": ["person:hull-cordell", "person:nomura-kichisaburo"],
      "places": ["place:washington-dc"],
      "documents": ["1941-pearl-harbor:document-japanese-memorandum"]
    },
    "sources": [
      {
        "source": "source:peace-and-war-1943",
        "note": "doc. 265 — the memorandum of the conversation, which records each of these times, the ambassador's explanation, and the memorandum itself, headed as handed to the Secretary of State at 2:20 p.m. on December 7, 1941"
      }
    ]
  },
  {
    "id": "1941-pearl-harbor:event-raid-over",
    "title": "The raid is over",
    "at": "1941-12-07T20:30:00Z",
    "kind": "battle",
    "significance": "minor",
    "place": "place:pearl-harbor",
    "summary": "**1000, Honolulu.** The last aircraft turn north towards the carriers. In under two hours eight battleships, three light cruisers and three destroyers have been sunk or put out of action; 92 naval aircraft destroyed and 31 damaged, and 96 Army aircraft lost including those burnt in the depots; 2,403 dead and 1,178 wounded, most of them naval. The Japanese lost about fifty aircraft and five midget submarines.",
    "links": {
      "places": ["place:pearl-harbor"],
      "formations": [
        "1941-pearl-harbor:pacific-fleet",
        "1941-pearl-harbor:hawaiian-department",
        "1941-pearl-harbor:us-carriers"
      ],
      "battles": ["1941-pearl-harbor:oahu"]
    },
    "sources": [
      {
        "source": "source:morton-1962",
        "note": "ch. VI — “By 1000 the raid was over and the Japanese planes were heading north toward the carriers”; the ships, the aircraft, “American casualties for the day were 2,403 men killed and 1,178 wounded, most of them naval personnel”, and the Japanese loss of “only about fifty planes and five midget submarines”. No pages are written; see the pack README"
      }
    ]
  },
  {
    "id": "1941-pearl-harbor:event-nagumo-turns-away",
    "title": "Nagumo turns away",
    "at": "1941-12-07T22:45:00Z",
    "kind": "decision",
    "significance": "major",
    "lngLat": [-157.99, 25.9],